<?xml version="1.0" encoding="UTF-8"?>

<xs:schema xmlns:xs="http://www.w3.org/2001/XMLSchema"
  xmlns="http://www.nakov.com/schemas/library"
  targetNamespace="http://www.nakov.com/schemas/library">
  
	<xs:element name="library">
		<xs:complexType>
			<xs:sequence>
				<xs:element ref="book" maxOccurs="unbounded"/>
			</xs:sequence>
			<xs:attribute name="name" type="xs:string" use="optional"/>
		</xs:complexType>
	</xs:element>

	<xs:element name="book">
		<xs:complexType>
			<xs:sequence>
				<xs:element ref="title"/>
				<xs:element ref="author"/>
				<xs:element ref="isbn"/>
			</xs:sequence>
		</xs:complexType>
	</xs:element>
	
	<xs:element name="title" type="xs:string"/>
	<xs:element name="author" type="xs:string"/>
	<xs:element name="isbn" type="xs:string"/>

</xs:schema>
